{
    "$schema": "../schema.json",
    "a_bool": null,
    "a_list": null,
    "a_list_of_any": null,
    "a_map_of_any": null,
    "a_map_of_strings": null,
    "a_nullable_string": null,
    "a_number": null,
    "a_set_of_any": null,
    "a_set": null,
    "a_string": null,
    "a_tuple": null,
    "a_variable_in_another_file": null,
    "an_any_as_boolean": null,
    "an_any_as_list": null,
    "an_any_as_map": null,
    "an_any_as_number": null,
    "an_any_as_string": null,
    "an_object": null,
    "an_unspecified_as_boolean": null,
    "an_unspecified_as_list": null,
    "an_unspecified_as_map": null,
    "an_unspecified_as_number": null,
    "an_unspecified_as_string": null
}